{
  "$schema": "http://json-schema.org/draft-07/schema#",
  "title": "Altera Slopes Registry",
  "type": "object",
  "properties": {
    "country_code": {
      "type": "string",
      "pattern": "^[a-z]{2}$"
    },
    "region_slug": {
      "type": "string",
      "pattern": "^[a-z0-9-]+$"
    },
    "place_slug": { "type": "string" },
    "slopes": {
      "type": "array",
      "items": {
        "type": "object",
        "properties": {
          "id": {
            "description": "Stable identifier. Historically strings; SkiWatch source uses integers, so both are accepted.",
            "type": ["string", "integer"]
          },
          "name": { "type": "string" },
          "name_i18n": {
            "type": "object",
            "description": "Locale-keyed names matching SkiWatch's LocalizedText shape.",
            "patternProperties": { "^[a-z]{2}$": { "type": "string" } },
            "additionalProperties": false
          },
          "type": { "enum": ["run", "lift", "access_route"] },
          "difficulty": {
            "description": "Unified international difficulty band. Korean resorts label these as 초급/중급/상급/최상급 (signed as one black / two black for advanced/expert); North American resorts use green/blue/black/double-black. The data uses the international name; consumers map to local labelling at render time.",
            "oneOf": [
              { "const": "super_beginner", "description": "Bunny hill — beginner area at the base, often a magic carpet. KR: 초보." },
              { "const": "beginner", "description": "Easiest groomed run. NA: green circle. KR: 초급." },
              { "const": "beginner_intermediate", "description": "Stepping-stone band between beginner and intermediate. KR: 초중급." },
              { "const": "intermediate", "description": "Standard cruising run. NA: blue square. KR: 중급." },
              { "const": "intermediate_advanced", "description": "Stepping-stone band between intermediate and advanced. KR: 중상급." },
              { "const": "advanced", "description": "Demanding groomed or moguled run. NA: single black diamond. KR: 상급, signed as one black." },
              { "const": "expert", "description": "Steep / technical / off-piste-adjacent. NA: double black diamond. KR: 최상급, signed as two black." },
              { "const": "pro", "description": "Competition / extreme — beyond expert public-skier scope." },
              { "const": "terrain_park", "description": "Features (rails, jumps, halfpipe). Difficulty varies independently of the slope band." },
              { "const": "backcountry", "description": "Off-piste / non-patrolled / requires gear and judgement." }
            ]
          },
          "length_m": { "type": ["number", "null"] },
          "width_m": { "type": ["number", "null"] },
          "area_m2": { "type": ["number", "null"] },
          "elevation_m": { "type": ["number", "null"] },
          "min_angle_deg": { "type": ["number", "null"] },
          "avg_angle_deg": { "type": ["number", "null"] },
          "max_angle_deg": { "type": ["number", "null"] },
          "connected_slope_ids": {
            "type": "array",
            "items": { "type": ["string", "integer"] }
          },
          "connected_lift_ids": {
            "type": "array",
            "items": { "type": ["string", "integer"] }
          },
          "coordinates": {
            "type": "array",
            "items": {
              "type": "object",
              "properties": {
                "lat": { "type": "number" },
                "lon": { "type": "number" }
              }
            }
          }
        },
        "required": ["id", "name"]
      }
    }
  },
  "required": ["country_code", "region_slug", "place_slug", "slopes"]
}
