{
  "$schema": "../../../../schemas/slope.schema.json",
  "country_code": "kr",
  "region_slug": "gyeongsangnam-do",
  "place_slug": "eden-valley",
  "slopes": [
    {
      "id": "basic",
      "name": "Basic",
      "name_i18n": {
        "ko": "베이직",
        "en": "Basic",
        "ja": "バエジャイチャイク"
      },
      "type": "run",
      "difficulty": "beginner",
      "length_m": 587,
      "width_m": 49,
      "area_m2": 34385,
      "avg_angle_deg": 6.84277341263094
    },
    {
      "id": "main",
      "name": "Main",
      "name_i18n": {
        "ko": "메인",
        "en": "Main",
        "ja": "マエジャイン"
      },
      "type": "run",
      "difficulty": "beginner",
      "length_m": 454,
      "width_m": 45,
      "area_m2": 43162,
      "avg_angle_deg": 5.710593137499643
    },
    {
      "id": "jupiter",
      "name": "Jupiter",
      "name_i18n": {
        "ko": "쥬피터",
        "en": "Jupiter",
        "ja": "チャユハイパオ"
      },
      "type": "run",
      "difficulty": "intermediate",
      "length_m": 1023,
      "width_m": 42,
      "area_m2": 25580,
      "avg_angle_deg": 9.648045316098157
    },
    {
      "id": "saturn",
      "name": "Saturn",
      "name_i18n": {
        "ko": "새턴",
        "en": "Saturn",
        "ja": "サアパオン"
      },
      "type": "run",
      "difficulty": "intermediate",
      "length_m": 851,
      "width_m": 49,
      "area_m2": 24999,
      "avg_angle_deg": 12.4
    },
    {
      "id": "uranus",
      "name": "Uranus",
      "name_i18n": {
        "ko": "우라누스",
        "en": "Uranus",
        "ja": "ジャウラアナウサウ"
      },
      "type": "run",
      "difficulty": "intermediate",
      "length_m": 1495,
      "width_m": 54,
      "area_m2": 56476,
      "avg_angle_deg": 9.090276920822323
    },
    {
      "id": "mercury",
      "name": "Mercury",
      "name_i18n": {
        "ko": "머큐리",
        "en": "Mercury",
        "ja": "マオタユライ"
      },
      "type": "run",
      "difficulty": "advanced",
      "length_m": 949,
      "width_m": 50,
      "area_m2": 23402,
      "avg_angle_deg": 15.109575122340466
    },
    {
      "id": "venus",
      "name": "Venus",
      "name_i18n": {
        "ko": "비너스",
        "en": "Venus",
        "ja": "ヴィーナス"
      },
      "type": "run",
      "difficulty": "advanced",
      "length_m": 862,
      "width_m": 46,
      "area_m2": 18416,
      "avg_angle_deg": 16.69924423399362
    }
  ]
}
