{
  "$schema": "../../../schemas/slope.schema.json",
  "country_code": "kr",
  "region_slug": "gangwon",
  "place_slug": "alpensia",
  "slopes": [
    {
      "id": "bravo",
      "name": "Bravo",
      "name_i18n": {
        "ko": "브라보",
        "en": "Bravo",
        "ja": "ブラボー"
      },
      "type": "run",
      "difficulty": "intermediate",
      "length_m": 1351,
      "coordinates": [
        {
          "lat": 37.6500732,
          "lon": 128.6726537
        },
        {
          "lat": 37.6502091,
          "lon": 128.6724821
        },
        {
          "lat": 37.6501752,
          "lon": 128.6721924
        },
        {
          "lat": 37.6498014,
          "lon": 128.6715916
        },
        {
          "lat": 37.6493597,
          "lon": 128.6712268
        },
        {
          "lat": 37.6490879,
          "lon": 128.6706582
        },
        {
          "lat": 37.6491218,
          "lon": 128.6699286
        },
        {
          "lat": 37.6494276,
          "lon": 128.6697784
        },
        {
          "lat": 37.6498354,
          "lon": 128.6699072
        },
        {
          "lat": 37.6505065,
          "lon": 128.6696819
        },
        {
          "lat": 37.6509991,
          "lon": 128.6698857
        },
        {
          "lat": 37.6515173,
          "lon": 128.6704114
        },
        {
          "lat": 37.6524432,
          "lon": 128.6708298
        },
        {
          "lat": 37.6532502,
          "lon": 128.6713126
        },
        {
          "lat": 37.6543034,
          "lon": 128.6727396
        },
        {
          "lat": 37.6546177,
          "lon": 128.6733189
        }
      ],
      "area_m2": 49115,
      "elevation_m": 194,
      "avg_angle_deg": 4.915342887157992,
      "connected_slope_ids": [
        "charlie"
      ],
      "connected_lift_ids": []
    },
    {
      "id": "alpha",
      "name": "Alpha",
      "name_i18n": {
        "ko": "알파",
        "en": "Alpha",
        "ja": "アルファ"
      },
      "type": "run",
      "difficulty": "beginner",
      "length_m": 648,
      "coordinates": [
        {
          "lat": 37.6518061,
          "lon": 128.6694244
        },
        {
          "lat": 37.6530123,
          "lon": 128.6700359
        },
        {
          "lat": 37.6540826,
          "lon": 128.6710015
        },
        {
          "lat": 37.6560702,
          "lon": 128.6724928
        }
      ],
      "area_m2": 32481,
      "elevation_m": 78,
      "avg_angle_deg": 3.9471525884133127,
      "connected_slope_ids": [],
      "connected_lift_ids": []
    },
    {
      "id": "charlie",
      "name": "Charlie",
      "name_i18n": {
        "ko": "찰리",
        "en": "Charlie",
        "ja": "チャーリー"
      },
      "type": "run",
      "difficulty": "expert",
      "length_m": 374,
      "coordinates": [
        {
          "lat": 37.6503875,
          "lon": 128.6728147
        },
        {
          "lat": 37.6513899,
          "lon": 128.6723426
        },
        {
          "lat": 37.6527745,
          "lon": 128.671656
        },
        {
          "lat": 37.6536579,
          "lon": 128.6720744
        },
        {
          "lat": 37.6546177,
          "lon": 128.6733189
        },
        {
          "lat": 37.6560447,
          "lon": 128.6739197
        }
      ],
      "area_m2": 13794,
      "elevation_m": 194,
      "avg_angle_deg": 11.914643827788685,
      "connected_slope_ids": [
        "bravo"
      ],
      "connected_lift_ids": [
        "unnamed-477491142-l477491142"
      ]
    },
    {
      "id": "delta",
      "name": "Delta",
      "name_i18n": {
        "ko": "델타",
        "en": "Delta",
        "ja": "デルタ"
      },
      "type": "run",
      "difficulty": "advanced",
      "length_m": 634,
      "coordinates": [
        {
          "lat": 37.6502074,
          "lon": 128.6733426
        },
        {
          "lat": 37.6517212,
          "lon": 128.6733618
        },
        {
          "lat": 37.6526131,
          "lon": 128.6732331
        },
        {
          "lat": 37.65342,
          "lon": 128.6736944
        },
        {
          "lat": 37.6544139,
          "lon": 128.6741451
        },
        {
          "lat": 37.6560447,
          "lon": 128.6744133
        }
      ],
      "area_m2": 12990,
      "elevation_m": 170,
      "avg_angle_deg": 9.369385096487484,
      "connected_slope_ids": [
        "eco"
      ],
      "connected_lift_ids": [
        "unnamed-477491143-l477491143"
      ]
    },
    {
      "id": "foxtrot",
      "name": "Foxtrot",
      "name_i18n": {
        "ko": "폭스트롯",
        "en": "Foxtrot",
        "ja": "フォックストロット"
      },
      "type": "run",
      "difficulty": "expert",
      "length_m": 826,
      "coordinates": [
        {
          "lat": 37.6501157,
          "lon": 128.6738017
        },
        {
          "lat": 37.6507528,
          "lon": 128.6749497
        },
        {
          "lat": 37.6514409,
          "lon": 128.6757973
        },
        {
          "lat": 37.6522818,
          "lon": 128.6761406
        },
        {
          "lat": 37.6538193,
          "lon": 128.676087
        },
        {
          "lat": 37.6561381,
          "lon": 128.6752609
        }
      ],
      "area_m2": 26158,
      "elevation_m": 194,
      "avg_angle_deg": 8.194263334630211,
      "connected_slope_ids": [],
      "connected_lift_ids": []
    },
    {
      "id": "echo",
      "name": "Echo",
      "name_i18n": {
        "ko": "에코",
        "en": "Echo",
        "ja": "エコー"
      },
      "type": "run",
      "difficulty": "advanced",
      "length_m": 762,
      "area_m2": 43110,
      "elevation_m": 194,
      "avg_angle_deg": 9.034402602139247,
      "coordinates": [
        {
          "lat": 37.6502074,
          "lon": 128.6733426
        },
        {
          "lat": 37.6516362,
          "lon": 128.6735121
        },
        {
          "lat": 37.6527405,
          "lon": 128.6744025
        },
        {
          "lat": 37.6536579,
          "lon": 128.6746922
        },
        {
          "lat": 37.6558578,
          "lon": 128.6746922
        }
      ]
    }
  ]
}
